{
  "doctrine_proposals": [],
  "draft_digest": "sha256:1111111111111111111111111111111111111111111111111111111111111111",
  "draft_mode": 420,
  "predecessor_digest": null,
  "request_digest": "sha256:0000000000000000000000000000000000000000000000000000000000000000",
  "run_id": "run-1",
  "schema": "revision-record-v1",
  "target_document": "README.md"
}
